{
  "schema_version": "1",
  "transaction_id": "ctx-20260721T154307Z-cutover01",
  "environment": "production",
  "operator": "saintgroovie",
  "controller": "manual_flock_deploy",
  "host": "woodright-prod",
  "started_at": "2026-07-21T15:43:00Z",
  "updated_at": "2026-07-21T15:43:07Z",
  "state": "planned",
  "lock_path": "/srv/woodright/locks/live-cutover.lock",
  "expected": {
    "release_sha": "4997bb7900000000000000000000000000000000",
    "backend_digest": "sha256:aaaaaaaaaaaaaaaaaaaaaaaaaaaaaaaaaaaaaaaaaaaaaaaaaaaaaaaaaaaaaaaa",
    "storefront_digest": "sha256:bbbbbbbbbbbbbbbbbbbbbbbbbbbbbbbbbbbbbbbbbbbbbbbbbbbbbbbbbbbbbbbb"
  },
  "target": {
    "release_sha": "643a429927adc934b89596df34dddb4a9d096cf6",
    "backend_digest": "sha256:8fa5b643b222afda217733d2c652942b7b4fecb12d3d19aef143f55d86efdf17",
    "storefront_digest": "sha256:a2acd564200ce241c59087c07aa73978e1d12d7824056bb67ef7f0cb434fffc3"
  }
}